{
  "$schema": "http://json-schema.org/draft-07/schema#",
  "$id": "https://raw.githubusercontent.com/HyperSafeD/Sanctifier/main/schemas/vulnerability-db.json",
  "title": "Sanctifier Vulnerability Database",
  "description": "Schema for regex-based vulnerability databases consumed by `sanctifier analyze --vuln-db`.",
  "type": "object",
  "required": ["version", "last_updated", "description", "vulnerabilities"],
  "additionalProperties": false,
  "properties": {
    "version": {
      "type": "string",
      "pattern": "^[0-9]+\\.[0-9]+\\.[0-9]+$",
      "maxLength": 50,
      "description": "Database format version in semantic-version form."
    },
    "last_updated": {
      "type": "string",
      "format": "date",
      "description": "Date the database was last updated, in YYYY-MM-DD form."
    },
    "description": {
      "type": "string",
      "minLength": 1
    },
    "vulnerabilities": {
      "type": "array",
      "minItems": 1,
      "items": {
        "type": "object",
        "required": [
          "id",
          "name",
          "description",
          "severity",
          "category",
          "pattern",
          "recommendation"
        ],
        "additionalProperties": false,
        "properties": {
          "id": {
            "type": "string",
            "minLength": 1,
            "pattern": "^[A-Z0-9][A-Z0-9._-]*$",
            "maxLength": 100
          },
          "name": {
            "type": "string",
            "minLength": 1
          },
          "description": {
            "type": "string",
            "minLength": 1
          },
          "severity": {
            "type": "string",
            "enum": ["critical", "high", "medium", "low", "info"]
          },
          "category": {
            "type": "string",
            "minLength": 1
          },
          "pattern": {
            "type": "string",
            "minLength": 1,
            "description": "Rust regex crate compatible pattern. Regex compilation and overlap checks are enforced by the CLI loader."
          },
          "recommendation": {
            "type": "string",
            "minLength": 1
          },
          "references": {
            "type": "array",
            "items": {
              "type": "string",
              "format": "uri"
            },
            "default": []
          }
        }
      }
    }
  }
}
